{
  "schema_version": "ushso.review-request.v1",
  "request_id": "review-request:scale-annual-discharges:methods:2026-07-18",
  "review_tier": "ordinary_material_claim",
  "protocol": {
    "protocol_id": "cso.evidence-methods-measurement.v1",
    "version": "1.0.0",
    "protocol_hash": "sha256:37f245f9fadffda8e2faaeb67612eb3280859ae2e8f84b74e68df9a1dcfbbb72"
  },
  "reviewer": {
    "reviewer_id": "scale-annual-discharges:methods:1",
    "agent_slug": "healthit-clinical-data-analyst",
    "prompt_version": "2026-07-18",
    "repo_commit": "8ab81b1718f86bba18275e558459680f8c91b7c3",
    "model": "gpt-5.6-sol",
    "runtime": "codex-desktop-2026-07-18",
    "independence": {
      "prior_exposure": "none",
      "conflict_disclosures": [],
      "direct_material_conflict": false,
      "attestation": true
    }
  },
  "frozen_inputs": {
    "evidence_bundle_ref": "ushso-rebuild://scale-inputs/annual-discharges/public-evidence-bundle",
    "evidence_bundle_hash": "sha256:b8cad4dc793c86c1015dd0929cbb42d125158fc258d5569dccc8371b7dbd00a9",
    "identity_binding_ref": "git:76e16247cecce818d777b4a4ade56dc13dd7b2a8:contracts/reusable-run/v3/fixtures/annual-discharges/identity-binding.json",
    "identity_binding_hash": "sha256:b32743893ca30408d35e31b2ef0971f2fa581a5ab1ab5f91c42a28e933a8c378",
    "computations": [
      {
        "ref": "git:76e16247cecce818d777b4a4ade56dc13dd7b2a8:contracts/reusable-run/v3/fixtures/annual-discharges/cumulative-packet.json",
        "hash": "sha256:bb569b3dde1fa4435c658488b11493ebcfe88898f8d7b0571231ce66ca7621a6"
      },
      {
        "ref": "git:76e16247cecce818d777b4a4ade56dc13dd7b2a8:contracts/reusable-run/v3/fixtures/annual-discharges/no-execution-result.json",
        "hash": "sha256:c45fb84c82b3843023d2d7c227c60ba17bff278fb08760e7566b648215cb89b8"
      }
    ],
    "claim_candidates": [
      {
        "claim_id": "claim:scale-v1:annual-discharges-cycle:no-execution:2026-07-18",
        "claim_hash": "sha256:d2d93fbaf9d83e4902bf29e02c3f68b91e08a432a55421a30fd0065b70457536",
        "evidence_refs": [
          "claim:scale-v1:annual-discharges-cycle:no-execution:2026-07-18",
          "cms-hcris:210032:number-of-beds",
          "cms-pos:210032:bed_cnt",
          "cms-pos:390027:bed_cnt",
          "computation:scale-v1:all-six:no-score:2026-07-16",
          "conflict:chestnut-hill-ownership-and-bases",
          "conflict:christianacare-shared-cms-reporting-entity",
          "conflict:christianacare:annual-discharges:comparability",
          "conflict:christianacare:operating_revenue_usd:comparability",
          "conflict:cooper-childrens-separate-hospital",
          "conflict:cooper-university-health-care:annual-discharges:comparability",
          "conflict:cooper-university-health-care:operating_revenue_usd:comparability",
          "conflict:jefferson-health:annual-discharges:comparability",
          "conflict:jefferson-health:operating_revenue_usd:comparability",
          "conflict:main-line-health:annual-discharges:comparability",
          "conflict:main-line-health:operating_revenue_usd:comparability",
          "conflict:penn-medicine:annual-discharges:comparability",
          "conflict:penn-medicine:operating_revenue_usd:comparability",
          "conflict:temple-health:annual-discharges:comparability",
          "conflict:temple-health:operating_revenue_usd:comparability",
          "conflict:temple-shared-cms-reporting-entity",
          "conflict:union-bed-bases",
          "coverage:bed-missing:cooper-university-health-care:childrens-regional",
          "coverage:bed-missing:jefferson-health:rothman-orthopaedic-specialty-hospital",
          "coverage:bed-missing:penn-medicine:hup-cedar",
          "identity-binding:scale-v1:all-six-roster-bed:2026-07-16",
          "md-bed:union:licensed-fy2026",
          "observation:christianacare:annual-discharges:candidate",
          "observation:cooper-university-health-care:annual-discharges:candidate",
          "observation:jefferson-health:annual-discharges:candidate",
          "observation:main-line-health:annual-discharges:candidate",
          "observation:penn-medicine:annual-discharges:candidate",
          "observation:temple-health:annual-discharges:candidate",
          "receipt:christianacare:annual-discharges:linkage",
          "receipt:christianacare:annual-discharges:system",
          "receipt:cooper-university-health-care:annual-discharges:linkage",
          "receipt:cooper-university-health-care:annual-discharges:system",
          "receipt:jefferson-health:annual-discharges:linkage",
          "receipt:jefferson-health:annual-discharges:system",
          "receipt:main-line-health:annual-discharges:linkage",
          "receipt:main-line-health:annual-discharges:system",
          "receipt:penn-medicine:annual-discharges:linkage",
          "receipt:penn-medicine:annual-discharges:system",
          "receipt:temple-health:annual-discharges:linkage",
          "receipt:temple-health:annual-discharges:system",
          "roster:penn-medicine:hup-cedar",
          "roster:temple-health:chestnut-hill",
          "scale-input-binding:annual-discharges:all-six:2026-07-18",
          "scale-input-packet:all-six:annual-discharges-cycle:2026-07-18",
          "scale-no-execution:annual-discharges:2026-07-18",
          "scenario:scale-v1:all-six-roster-bed-readiness:2026-07-16",
          "scenario:scale-v1:annual-discharges-fitness:2026-07-18",
          "state-bed:pa-hospital-report-2024-1a:temple-university-hospital:beds-set-up-and-staffed",
          "state-bed:pa-hospital-report-2024-1a:temple-university-hospital:licensed-beds"
        ]
      }
    ]
  },
  "decision_scenario": {
    "ref": "git:76e16247cecce818d777b4a4ade56dc13dd7b2a8:contracts/reusable-run/v3/fixtures/annual-discharges/decision-scenario.json",
    "hash": "sha256:467ca4fcbb85fa7318d20344f4a18f5cfa227ecf0fc92699711d64ba0cee1d6f"
  },
  "posture_taxonomy": [
    "acquire",
    "merge_affiliate",
    "partner",
    "compete",
    "build_capacity",
    "defer"
  ],
  "evidence_boundary": "Frozen temporary-only annual-discharges packet. All 54 six-system-by-nine-input cells remain preserved as 0 populated, 24 blocked_source_conflict, and 30 not_yet_researched. Six annual-discharges conflicts, six revenue conflicts, and five roster/bed conflicts make 17 cumulative open conflicts. The 26 prior material discrepancies, 24 prior reviewer concerns, ten prior overturn gates, two revenue-review discrepancies, and 56 revenue-review concerns remain unresolved. No averaging, no adjudication, human authority, calculation, sensitivity, projection, recommendation, promotion, or deployment is authorized.",
  "candidate_review": {
    "competence_role": "evidence_methods_measurement_biostatistics",
    "exposure_status": "independent_first",
    "evidence_mutated": false,
    "claim_dispositions": [
      {
        "claim_id": "claim:scale-v1:annual-discharges-cycle:no-execution:2026-07-18",
        "evidence_assessment": "supported_by_available_evidence",
        "review_disposition": "request_additional_evidence",
        "evidence_refs": [
          "scale-input-packet:all-six:annual-discharges-cycle:2026-07-18",
          "scale-no-execution:annual-discharges:2026-07-18",
          "conflict:christianacare:annual-discharges:comparability",
          "conflict:jefferson-health:annual-discharges:comparability",
          "conflict:temple-health:annual-discharges:comparability",
          "conflict:penn-medicine:annual-discharges:comparability",
          "conflict:cooper-university-health-care:annual-discharges:comparability",
          "conflict:main-line-health:annual-discharges:comparability",
          "conflict:chestnut-hill-ownership-and-bases",
          "conflict:christianacare-shared-cms-reporting-entity",
          "conflict:cooper-childrens-separate-hospital",
          "conflict:temple-shared-cms-reporting-entity",
          "conflict:union-bed-bases",
          "conflict:christianacare:operating_revenue_usd:comparability",
          "conflict:jefferson-health:operating_revenue_usd:comparability",
          "conflict:temple-health:operating_revenue_usd:comparability",
          "conflict:penn-medicine:operating_revenue_usd:comparability",
          "conflict:cooper-university-health-care:operating_revenue_usd:comparability",
          "conflict:main-line-health:operating_revenue_usd:comparability"
        ],
        "limitation": "Frozen temporary-only annual-discharges packet. All 54 six-system-by-nine-input cells remain preserved as 0 populated, 24 blocked_source_conflict, and 30 not_yet_researched. Six annual-discharges conflicts, six revenue conflicts, and five roster/bed conflicts make 17 cumulative open conflicts. The 26 prior material discrepancies, 24 prior reviewer concerns, ten prior overturn gates, two revenue-review discrepancies, and 56 revenue-review concerns remain unresolved. No averaging, no adjudication, human authority, calculation, sensitivity, projection, recommendation, promotion, or deployment is authorized.",
        "overturn_condition": "Populate all six annual-discharges cells from authoritative, receipted evidence under one comparable period, organizational boundary, discharge definition, care-setting and payer denominator, rehabilitation rule, shared-CCN rule, and facility-to-system aggregation; resolve all 17 cumulative conflicts; preserve and satisfy the 26 prior material discrepancies, 24 prior reviewer concerns, ten prior overturn gates, two revenue-review discrepancies, and 56 revenue-review concerns; then obtain a new independent review without imputation, fabricated zeroes, averaging, adjudication, or human-authority claims."
      }
    ],
    "posture_assessments": [
      {
        "posture": "acquire",
        "effect": "unresolved",
        "claim_refs": [
          "claim:scale-v1:annual-discharges-cycle:no-execution:2026-07-18"
        ],
        "evidence_refs": [